{
  "schemaVersion": 1,
  "id": "project-web-ui-fixture",
  "discipline": "solution-architecture",
  "version": "1.0.0",
  "appliesTo": {
    "deliveryFlows": ["poc", "implementation", "pdlc"],
    "stages": ["solution-design", "build-readiness"],
    "technologies": ["web-ui"]
  },
  "defaults": [
    {
      "key": "engineering.web-stack",
      "title": "Use the project-approved web stack",
      "topic": "qualityAttributes",
      "statement": "Use the project-approved TypeScript web stack and the existing build system when one is already in scope.",
      "rationale": "The fixture verifies project-level default precedence without imposing a product requirement.",
      "controlRefs": []
    }
  ]
}
